,brand,rating,review
314,Mount Hagen Kaffee,5,"Ich muss sagen, dass mir der Kaffee von Mount Hagen sehr gut gefällt und deshalb nur weiterempfehlen kann. Bitte kaufen Sie diesen Kaffee anstelle von normalem Aldi-Kaffee kaufen. sie helfen Den armen Kindern in Afrika und Sie vollbringen eine moralische Wohltat. Natürlich kostet dieser Kaffee ein paar Cent mehr als Billig-Kaffee aber was tut das in unserem Zeitalter schon zur Sache?"
315,Mount Hagen Kaffee,5,"Meiner Meinung nach der mit Abstand beste Bio- und Fairtrage-Kaffee auf dem Markt. Abgesehen davon, dass er äußerst stilvoll und edel aussieht und nicht nur das typische EU-Biosiegel trägt, schmeckt er auch unheimlich lecker. Besser als „vollmundig, mild und säurearm, dennoch intensiv“ kann ich den Geschmack nicht beschreiben – da fehlen unserer Sprache einfach die Worte. Deshalb meine Empfehlung: einfach ausprobieren, es lohnt sich! 🙂"
316,Mount Hagen Kaffee,5,"Dieser Kaffee ist einer meiner Lieblings-Bio Kaffees. Gibt es auch als Granulat. Empfehle ich gern weiter. Schmeckt gut, vorallem Fairtrad und auch der Preis ist korrekt. Es gibt ihn in verschiedenen Sorten und auch in verschiedenen Größenabpackungen, so dass auch eine Singlehaushalt nicht so kurz kommt. Ich selber benutze eine Press-Maschiene."
317,Mount Hagen Kaffee,5,"Wir trinken diesen Kaffe als Instant-Kaffee schon seit Jahren und sind mit dem Geschmack sehr zufrieden. Wenn wir diesen Kaffee Gästen anbieten, weil man nicht immer Zeit zum frisch Aufbrühen hat, sind die immer positiv überrascht. Er ist Bio, er ist Fair Trade und kommt aus Papua Neuguinea, das finden wir gut. Er hat eine Glas-Verpackung, leider einen Deckel aus Plastik, aber das lässt sich scheinbar anders schlecht machen."
318,Mount Hagen Kaffee,5,"Ich trinke seit etwa anderthalb Jahren die Instantvariante dieses Herstellers mit Koffein und bin nach wie vor begeistert, wie unkompliziert und lecker Fairtrade sein kann. Ich würde ihn auch kaufen, wenn er noch teurer wäre. Daher also eigentlich sechs Sterne. 🙂"
319,Mount Hagen Kaffee,5,"Der Kaffee von Mount Hagen stammt aus der gleichnamigen Provinz in Papua Neuguinea. Daher trägt der Kaffee auch das Wappentier dieser Region. Wir kennen einen Großteil des Sortiments, von den Kaffeepads, über den Bohnenkaffee, Cappuccino, Espresso oder den Instant-Kaffee. Durchweg können wir sowohl über positive Kundenrückmeldungen als auch persönliche Erfahrungen berichten. Daher vergeben wir volle Punktzahl für den Mount Hagen Kaffee."
320,Mount Hagen Kaffee,5,"Ich kaufe immer den gemahlenen Espresso (ich besitze leider keine Kaffeemühle) von Mount Hagen und bin seit der ersten Tasse vollkommen überzeugt. Zubereitet in einer italienischen Moka Express ist der Espresso sowohl pur als auch mit Milch ein Genuss. Das Aroma ist kräftig und sanft zugleich, ein wenig schokoladig und nicht bitter, alles in allem ein abgerundetes Geschmackserlebnis. Ein i-Tüpfelchen wäre natürlich noch eine nachhaltigere Verpackung, aber auch ohne diese vergebe ich 5 Sterne für diesen Kaffee."
321,J.J. Darboven Café Intención,5,"Sehr feiner mild gerösteter Kaffee,der auch wenig Säure hat und von uns daher sehr gut vertragen wird.Auch der Geschmack kommt nicht nur bei uns,sondern auch bei Gästen sehr gut an,wobei ich sagen muss,dass ich die ganzen Bohnen kaufe und immer passend mahle,daher wird auch das Aroma immer gelobt.Er ist in sehr vielen Supermärkten vorrätig,teilweise auch im Angebot,er hat aber auch ohne Angebot ein hervorragendes Preis-Leistungsverhältnis."
322,J.J. Darboven Café Intención,5,"Der Bio- und Fair Trade Kaffee von J.J.Darboven ist ein leckerer Kaffee, der nicht viel Säure enthält und gut verträglich ist. Da es den auch in Pad Form gibt, ist er eine gute Alternative im hektischen Alltag. Aufgrund der Tatsache, dass es sich hier um einen Bio-Kaffee mit Fair Trade Hintergrund handelt, macht das Kaffeetrinken auch kein schlechtes Gewissen, da bekannt ist, unter welchen Bedingungen andere Firmen ihren Kaffee herstellen lassen…"
323,J.J. Darboven Café Intención,5,"Der Kaffee schmeckt sehr lecker, nicht zu stark und nicht zu mild."
324,J.J. Darboven Café Intención,5,"Ich trinke den Kaffee von Darboven Café Intención schon seit ich eine eigene Kaffeemaschine habe und bin begeistert. Der Kaffee schmeckt mild und ist doch nicht zu schwach, meiner Meinung nach der beste Kaffee, den ich je getrunken habe! Der Preis ist völlig in Ordnung und gerechtfertigt."
325,J.J. Darboven Café Intención,5,"Ein milder, fast angenehm „weicher“ Kaffee, dennoch mit einem sehr gutem Aroma – sehr selten in dieser Geschmackskomposition anzutreffen. Bei ökologischem Anbau ist das Preis-Leistungsverhätnis in meinen Augen sehr gut. Ich habe den Kaffee inzwischen mit Handaufguss Methode, mit Braun Kaffeemaschine, mit Pads für Senseo Maschine, im Espressokocher von Bialetti und in der Jura Espressomaschine getestet – Fazit: Alle gängigen Zubereitungsarten geben diesen Kaffee hervorragend wieder."
326,J.J. Darboven Café Intención,5,"Der Kaffee von J.J.Darboven ist sehr aromatisch ,kräftig und geschmackvoll.Ich bevorzuge den ganze Bohne,er entfaltet beim mahlen sein ganzes Aroma. Gutes Preis-Leistungsverhältnis und aus fairem Handel .Voll und ganz empfehlenswert"
327,J.J. Darboven Café Intención,5,Wunderbar aromatisch und dabei sehr ergiebig.
328,J.J. Darboven Café Intención,5,"Fair, bio und geschmacklich auch passabel, finde ich (Geschmack ist natürlich Geschmackssache, die beste fair + bio Sorte ist es für mich persönlich (aber) nicht – z.B. schmeckt mir die milde Variante von Café Cubíta von El Puente und eine milde gepa Sorte aus Mexiko deutlich besser)"
329,J.J. Darboven Café Intención,5,"Sehr gutes Preis/Leistungsverhältnis und die Röstung ist ideal für meinen Magen. Leicht bekömmlich und dennoch aromatisch. Ich zahle gerne mehr für Fairtrade, dabei ist der J.J.Darboven Café Intención wirklich nicht teuer!"
330,J.J. Darboven Café Intención,5,Ich benutze diesen Kaffee schon seit Jahren als ganze Bohne im Kaffeevollautomat. Er hat ein kräftiges Aroma und ist nicht sauer oder bitter dabei. Man kann ihn daher auch sehr gut „schwarz“ trinken. Der Preis von ca. 16 Euro pro Kilo ist auch unschlagbar.
331,GEPA Kaffee,5,Ich liebe diesen Kaffee.Er hat ein wunderbares Aroma.
332,GEPA Kaffee,5,ein wunderbarer fairer Bio-Kaffee zum Morgen. Die Biomischung „Organico“ sagt mir dabei am meisten zu: nicht zu herb ein schöner runder Kaffegeschmack und dennoch ist man anschließend topfitt für den Tag. Schade dass Kaffee kein regionales Produkt ist.
333,GEPA Kaffee,5,"Habe oft Gepa Kaffee gekauft, ich liebe es."
334,GEPA Kaffee,5,"Fünf Sterne gibt es, weil die GEPA eine tolle, vielfältige Kaffee-Auswahl bietet, da ist für jeden das Richtige dabei. Die Kaffeebohnen werden schonend langzeitgeröstet, dadurch schmeckt der Kaffee sehr aromatisch. Vor allem der Organico ist sehr zu empfehlen. Hier kann man sich darauf verlassen, dass auch fair drin ist, wo fair drauf steht. Schön, dass die GEPA Kleinbauern und ihren Familien die Lebensgrundlage sichert!"
335,GEPA Kaffee,5,Morgens nach dem aufstehen diesen Kaffee zu riechen ist das Beste am ganzen Tag. Ich kann ihn nur weiterempfehlen.
336,GEPA Kaffee,5,Der Gepa Kaffee hat mich voll überzeugt. Er schmeckt sehr gut und hat ein tolles Aroma. Außerdem ist er ein fair gehandeltes Produkt.
337,GEPA Kaffee,5,"Die GEPA Kaffee´s erfüllen allen meine Kriterien. Bio, die Ansprüche der Firma liegen über dem Mindeststandard von Fairtradeprodukten und natürlich der vollmundige, aromatische Geschmack mit gut balancierter Säure. Der Organico ist bei uns nicht miehr wegzudenken, doch auch der Espresso und der Guatemaler überzeugen. Kaffee ist für mich ein absoluter Genuss und ich stehe lieber 10 Minuten früher auf und genieße, anstatt in aller Eile eine braune Brühe in mich zu schütten…"
338,GEPA Kaffee,5,"Ein super leckerer Kaffee, den man voll und ganz mit Gutem Gewissen trinken und genießen kann, weil man weiß, dass die Kaffee Bohnen fair gehandelt worden sind."
339,GEPA Kaffee,5,"Der Italienische Bio Espresso von GEPA verführt den Genießer in die sinnliche Welt Italiens. Seinen Namen trägt dieser Espresso zurecht. Beim öffnen der Packung empfängt man wohlwollend den köstlichen Duft der nach alter Tradition gerösteten Arabica-Bohne. Die exzellente Crema, die ich daraus zubereiten konnte, hat ein herb-würziges Aroma und veredelt mit seiner geschmacklichen Eleganz nachhaltig die Gaumenfreude. Selbst ohne Zucker oder Milch schmeckt der Espresso sehr gut und hat keinen bitteren Nachgeschmack.GEPA garantiert für den Fair Trade Handel und dies ist ein weiteres Plus für dieses hochwertige Produkt. Mich hat dieser Espresso überzeugt und somit kreiere ich mir damit allmögliche Kaffeespezialitäten. Die von mir vergebenen fünf Sterne verstehe ich als ein kleines Dankeschön an all jene, die an der Herstellung und Produktion des Italienischen Bio Espresso beteiligt sind."
340,GEPA Kaffee,5,"Auch wenn der GEPA Kaffee seinen Preis hat, ist er das auf jeden Fall auch wert. Besonders gut finde ich, dass man zwischen verschiedenen Spezialitäten auswählen kann. Auch die kleinere Abpackung ist sehr gut und unterstützt auch den Eindruck eines wertigen Produktes und dass es sich um ein Genussmittel handelt."
341,Mount Hagen Kaffee,4,Der espresso ist wunderbar! Ueberhaupt nicht bitter!!
342,Mount Hagen Kaffee,4,"Ich trinke seit Jahren mit Genuss den Mount Hagen Landkaffee. Vor einiger Zeit wurde etwas bei der Produktion umgestellt und der Kaffee war nicht mehr so gut lösbar und schmeckte anders. Ich schickte eine Dose an die Firma Mount Hagen mit einer Reklamation. Herr Suhr von der Firma Mount Hagen erklärte mir was geschehen war, entschuldigte sich, versprach mir dass der Kaffee bald in der ursprünglichen Qualität wieder verfügbar sein werde und schickte mir als Entschädigung 7 Dosen Kaffee und 2 Dosen lösliche Schokolade, was ich mehr als großzügig fand. Alle Achtung."
343,Mount Hagen Kaffee,4,"ich habe letztens den gemahlenen Espresso ausprobiert, da ich auf Urlaub war mit der Espressomaschine. Ich bin überzeugt ein sehr leckeres Produkt."
344,Mount Hagen Kaffee,4,"Neben dem Espresso kann ich auch den Arabica-Kaffee von Mount Hagen sehr empfehlen. Egal ob ganze Bohne oder gemahlen, beide Sorten haben ein außergewöhnliches Aroma."
345,Mount Hagen Kaffee,4,"Als überwiegende Tee-Trinkerin habe ich diesen Cappuccino für mich, Familie und Freunde entdeckt."
346,Mount Hagen Kaffee,4,"Sowohl Bio und fairtrade, als auch hervorragender Geschmack trotz löslichen Pulvers: sogar die „Kaffee-Freunde“ waren zufrieden 🙂"
347,Mount Hagen Kaffee,4,"Die Produkte von Mount Hagen bestehen nicht nur aus biologisch angebauten Kaffeebohnen (Naturland zertifiziert) und sind fair gehandelt, sie schmecken auch in der Tat hervorragend: Sehr ausgewogener, harmonischer Geschmack, geringe Säure, breites Aroma."
348,Mount Hagen Kaffee,4,"Ob Espressobohnen zu Hause für meinen Vollautomat oder Mount Hagen Instant als vollwertiger Ersatz auf Kurzurlaubstripps– ich bin ein Fan von Mount Hagen. Ich mag meinen Kaffee, besser Espresso klein, schwarz, stark – eben autentischer Geschmack."
349,Mount Hagen Kaffee,4,"Der Espresso ist super, wir trinken den sehr gerne, weil er einen tollen Geschmack hat."
350,Mount Hagen Kaffee,4,"Der Mount Hagen Espresso zeichnet sich aus durch seinen -wie ich finde- intensiven Geschmack und tollen, aromatischen Duft. Für den perfekten Start in den Tag. Die fünf Sterne verdient er daneben aber auch auf Grund des guten Preis-Leistungs-Verhältnisses und des fairen Handels. Toll, wenn man alles Gute unter einen Hut bekommt!"
351,Mount Hagen Kaffee,4,"Ich habe den Kaffee letztens im Bioladen entdeckt und bin seither begeistert. Werde den Kaffee weiter kaufen. Er schmeckt leicht, nicht zu stark und dennoch gut. Dass er auch mich bio ist, macht ihn für mich noch besser."
352,J.J. Darboven Café Intención,4,"Den „ecológico“ habe ich als Pads und muss sagen, dass er in einer großen Tasse etwas schwach rüberkommt. Klasse für zwischendurch oder spät nachmittags. Der Espresso als ganze Bohne ist ebenfalls mild, jedoch vollmundig im Geschmack."
353,J.J. Darboven Café Intención,4,"In unserer WG trinken wir nur den Intención Kaffee. Als ich in meine WG eingezogen bin, habe ich mich vorher noch nie mit der Problematik Kaffee-Produktion beschäftigt. Eine meiner Mitbewohnerinnen beschwerte sich aber jedes Mal, wenn ich einen „nicht-fair-trate“ Kaffee mit gebracht habe. Sie klärte mich auf, und seit dem kaufen wir nur noch Café Intención. Der schmeckt super, und mein Gewissen ist auch beruhigt!"
354,J.J. Darboven Café Intención,4,Ich trinke schon seit Jahren den Café Intencion Ecologico FairTrade. Der Kaffee schmeckt einfach lecker und ist nicht zu teuer.
355,J.J. Darboven Café Intención,4,"In unserem Kaffeevollautomat entfaltet sich der einzigartige volle Geschmack wunderbar. einfach lecker, so wie ich Kaffe mag!"
356,J.J. Darboven Café Intención,4,Dieser Kaffee ist ein sehr leckerer und harmonischer Kaffee sehr zu empfehlen
357,J.J. Darboven Café Intención,4,Mein absoluter Lieblingskaffee. Er schmeckt frisch aufgebrüht sehr gut und auch das Preis-Leistungsverhältnis stimmt.
358,J.J. Darboven Café Intención,4,"Mir gefällt besonders, dass es sich hierbei um einen mild geröstete Kaffee handelt mit sehr wenig Säure. Da ich schnell unter Sodbrennen leide ist mir dieser Punkt sehr wichtig und meine Erwartungen wurden hier vollstens erfüllt. Dafür bekam der Kaffe 4 Sterne von mir. Ansonsten schmeckt der Kaffe sehr aromatisch mit einer feinen Crema und der fünfte Stern wurde gern von mir dafür vergeben. Meine Familie und ich haben einen neuen Lieblingskaffee entdeckt."
359,J.J. Darboven Café Intención,4,Ausgesprochen aromatischer und vollmundiger Kaffeegenuss. Ich habe diesen Kaffee durch Zufall beim Stöbern entdeckt und ihn trotz des etwas höheren Preises gekauft. Nicht eine Tasse lang habe ich meine Kaufentscheidung bereut! Ein Stern Abzug gebe ich aufgrund des doch deutlich höheren Preises! Für spezielle Anlässe oder einfach mal eine genussvolle Tasse zwischendurch kann ich dieses Kaffee nur wärmstens weiterempfehlen!
360,J.J. Darboven Café Intención,4,"Dieser Kaffee schmeckt und ist ein wunderbarer „Alltagskaffee“. Nichts Besonderes zwar, aber ordentlich geröstet. Sicherlich gibt es geschmacklich bessere Fairtrade-Bio-Kaffees, aber der ist dann auch um einiges teurer und deshalb meine Sonn- und Feiertagsbohne. Ich nehme ganze Bohnen und mahle selbst."
361,J.J. Darboven Café Intención,4,"Man bekommt diesen Kaffee in fast jedem Supermarkt. Ich habe mich das erste Mal dafür entschieden, als ich es nicht mehr in den Bioladen geschafft habe und dringend Kaffee brauchte. Da ich mit dem Preis-Leistungs-Verhältnis sehr zufrieden bin, bin ich dabei geblieben. Ich mag, dass er relativ wenig Säure hat und mir dadurch auch bei größeren Portionen nicht auf den Magen schlägt. Das Aroma verfliegt leider nach längerer Lagerung auch in dichten Dosen, daher ein Stern Abzug."
362,GEPA Kaffee,5,der beste Espresso auf der Welt! Stark aber nicht bitter.
363,GEPA Kaffee,5,"zur Zeit trink ich GEPA Espresso Cargado, weil er hat 5 schwarze Bohnen auf der Geschmacksscale hat. jede dieser Bohnen hat er verdient, ein wirkliches „verwöhnaroma“ !!"
364,GEPA Kaffee,5,"teurer als der massenkaffee? im Einkauf ja, in der Benutzung nein!!"
365,GEPA Kaffee,5,"früher trank ich Masse in Massen, heute Klasse mit Genuss … ;-))"
366,GEPA Kaffee,5,"Gepa Kaffee ist für mich der einzig wirklich faire Kaffee. Gepa legt großen Wert darauf, dass Kleinbauern unterstützt werden und keine großen Plantagen. Deshalb gibt es eine Hektar-Begrenzung um überhaupt für Gepa produzieren zu können. Die Kleinbauern werden unterstützt, gefördert und bekommen regelmäßig Bonuszahlungen damit sie ihre Kinder zur Schule schicken können usw. Andere Kaffee-Sorten sind auch Fairtrade-zertifiziert, arbeiten aber durchaus auch mit großen Plantagen zusammen. Die Gepa tut das nicht. Und der Kaffee schmeckt natürlich hervorragend! 🙂"
367,GEPA Kaffee,5,"Seit vielen Jahren kaufen wir GEPA-Kaffee – wenn man „seine“ Sorte gefunden hat, ist der Genuss absolut ungetrübt – mit DEM Hintergrund an fairem Handel!"
368,GEPA Kaffee,5,"Ich kaufe gerne die Gepa-Kaffees, denn da habe ich eine nette Auswahl an verschiedenen Kaffees und es macht Spaß damit zu experimentieren. Allerdings hat das Besondere seinen Preis, weshalb diese Kaffees meine Sonn- und Feiertagsmischungen sind."
369,GEPA Kaffee,5,"Hallo zusammen, "
370,GEPA Kaffee,5,"Gepa hat seit einer gewissenzeit ein eigenen sogenannten fair+ siegel rausgebracht. Dabei handelt es sich um eine ich nenne es “ strengere “ kriterien für einen fairen handel. Mehr Geld pro fund, unterstützung für Bauer bei auf Bio Anbau Umstellung ect. Ihr könnt euch auf gepa.de mehr informationen holen was das angeht. Gepa bleibt, und das zurecht Top 1 unte den Kaffee verkäufern die auf Biologische, Ökologische, Nachhaltigekeit und fairem handel wert legen. Und der Kaffee schmeckt auch gut, vorallem wenn mann die Bohnen selbst frisch mahlt !"
371,GEPA Kaffee,5,"Seit Jahrzehnten mein Lieblingskaffee, wird immer besser und bekömmlicher. eignet sich sowohl für Filterung wie für Kaffeebereiter. Gibt es auch ohne Koffein, schmeckt genauso gut."
372,GEPA Kaffee,5,… im fairen Handel weist GEPA auf.
373,GEPA Kaffee,5,Und vom Geschmack her dürfte wohl für jede Zunge etwas im Sortiment sein …
374,GEPA Kaffee,5,"Als häufige Italien-Reisende und auch-schon-mal-länger-dort-gelebt-habende sind meine Ansprüche an Espresso hoch. Jetzt kann man natürlich alle großen italienischen Kaffeemarken auch in Deutschland kaufen, aber die sind dann weder Bio noch fair. Der gepa Italienischer Bio Espresso erfüllt diese Kriterien und steht geschmacklich Lavazza &amp; Co wirklich in nichts nach!"
375,GEPA Kaffee,5,"Seit ich meinen Lieblingskaffee von GEPA gefunden habe (Guatemala pur) genieße ich ihn jeden Morgen und möchte keinen anderen mehr trinken. Er ist zwar teuer und ich bin alles andere als reich, aber er ist fair und bio, super lecker und verträglich, und ich trinke halt eher wenig."
376,GEPA Kaffee,5,"Ich kann nur hoffen, dass es ihn auch weiterhin geben wird…"
377,Mount Hagen Kaffee,5,"Vom Geschmack einfach der beste. Rund, harmonisch, hier stimmt die Mischung."
378,Mount Hagen Kaffee,5,"das kompltte sortiment bei mount hagen ist bio und fair trade zertifiziert, die landkaffees gibt es in demeterqualität. und das beste: gerade die espressi ist großartig. schokoladig, ganz weich und aromatisch. sehr, sehr lecker. darum: maximal sterne."
379,Mount Hagen Kaffee,5,"Ausgewogenes Aroma, schön kräftig im Geschmack ohne bitter zu sein."
380,Mount Hagen Kaffee,5,"Ich mag diesen Kaffee sehr. Man schmeckt den Unterschied zu den handelsüblichen Discounter-Kaffees total. Sowohl der Instant-Kaffee als auch der Espresso und Röstkaffee schmecken vorzüglich und sind dabei auch sehr bekömmlich. Der Instant-Kaffee schmeckt mir übrigens supergut, obwohl ich sonst keine Instant-Kaffees mag."
381,Mount Hagen Kaffee,5,"Ich kenne nur den Espresso. Er läßt sich sehr gut fein mahlen. Der Duft ist sehr angenehm kräftig. Der fertige Espresso hat mir jedoch zu viel Säure und daher kann ich ihn nur sehr „dünn“ trinken, dafür fehlt ihm dann natürlich wieder Aroma. Sehr gut geht er als arabischer Kaffe mit Kardamom Koriander und Zimt, da kommt genügend Aroma über die Gewürze und die Säure wird überdeckt."
382,Mount Hagen Kaffee,5,… und fair gehandelt auch noch Genuss ohne schlechtes Gewissen
383,Mount Hagen Kaffee,5,"Ich finde es toll, dass es mittlerweile viele Fair Trade Produkte zu kaufen gibt. Den Kaffee hatte ich auch schon und er hat uns sehr gut geschmeckt"
384,Mount Hagen Kaffee,5,"habe ihn erst vor kurzem getrunken und war überrascht, wie gut er schmeckt. Auch mein Besuch hat er geschmeckt, Genussvoll und nicht bitter auch wenn er stark ist"
385,Mount Hagen Kaffee,5,"von dieser marke schmeckt der entcoffeinierte espresso sehr ähnlich wie der mit coffein. allerdings habe ich noch keine ganzen bohnen davon gefunden, da frisch gemahlener kaffee einfach noch ein stück aromatischer schmeckt als bereits gemahlener"
386,Mount Hagen Kaffee,5,"nicht nur BIO und Fair Trade, der schmeckt sogar richtig gut!"
387,J.J. Darboven Café Intención,5,"Der Kaffee wird sorgfältig angebaut daher greife ich immer wieder gern zu Fairtrade Sorten. Exzellent im Geschmack ein schöner dunkler kräftiger Kaffee perfekt für Kaffeeautomaten. Ich verwende ihn auch gern für Ice-Kaffee. Der Kaffee ist vollmundig, ausgewogen und harmonisch. Schön das er immer mehr die Supermarkt Regale erobert. Den Preis von ca. 4,99-5,99€ finde ich sehr angemessen."
388,J.J. Darboven Café Intención,5,ein Kaffee der voll und ganz meinen Geschmack trifft. Besonders zum Frühstück mögen wir ihn gerne.
389,J.J. Darboven Café Intención,5,"Der Kaffee ist vollmundig,schmeckt gut.Ich bin gern bereit einen höheren Preis dafür zu zahlen."
390,J.J. Darboven Café Intención,5,Kaffee ist wirklich Geschmackssache! Ich habe J.J. D.-Café Intención ecológico zum ersten Mal im Urlaub auf Langeoog genossen und er schmeckt mir immer noch von allen fairtrade-Kaffees am besten. Im Vergleich zu anderen ist er für mich preislich akzeptabel und wurde auch von der Stiftung Warentest als „gut“ befunden. Deshalb 5 Sterne.
391,J.J. Darboven Café Intención,5,"sehr gut und preiswert für fairtrade und bio. Ob als Filterkaffee oder Pads für die Senseomaschine, sehr empfehlenswert!"
392,J.J. Darboven Café Intención,5,"Preislich nicht zu unterbieten und dafür gibts tollen runden Kaffeegeschmack, nicht sauer und auch stark gebrüht noch toll genießbar. Schmeckt mit Kuh- oder Sojamilch und schmeckte bisher auch nicht verbrannt, im konventionellen Supermarkt erhältlich, fünf Euro und erfüllt die relevanten Auflagen. Kann ich wärmstens empfehlen, wenn fair und bio wichtig, aber der Geldbeutel immer knapp ist."
393,J.J. Darboven Café Intención,5,"Die Café Intención pads sind für mich die besten fair trade pads, die ich bisher gefunden habe. Vollmundig und kräftig im Geschmack, wie ich es mag, aber nicht bitter und für mich gut verträglich. Und auch nach einigen Tagen in der Dose (einen Teil behalte ich immer im Kühlschrank, den anderen in der Kaffeedose) noch frisch und gut geniessbar. Und nicht ganz unwichtig: der Preis ist auch fair…"
394,J.J. Darboven Café Intención,5,"Darbovens kaffe ist bekannt, schmeckt , gibts auch koffeinfrei und das Fair-Trade-Siegel ist keine Pseudo-Eigenkreation"
395,J.J. Darboven Café Intención,5,Ich kaufe immer die Kaffee-Pads von Intencion. Der Kaffee schmeckt sehr lecker und das Preis-Leistungsverhältnis stimmt meiner Meinung nach auch. Ich kann diesen Kaffee jedem guten Gewissens empfehlen.
396,J.J. Darboven Café Intención,5,Seit mehreren Jahren ist der J.J.Darboven Café Intención mein absoluter Favorit. ich als Kaffee-Junkie trinke regelmäßig und viel Kaffe und lege dabei Wert auf: – Geschmack – ökologischer Anbau – Fair Trade – bezahlbarer Preis – Verfügbarkeit
397,J.J. Darboven Café Intención,5,Der J.J.Darboven Café Intención überzeugt bei allen Kriterien und wird von mir aufgrund des fairen Preis/Leistungsverhältnises auch zukünftig gekauft.
398,J.J. Darboven Café Intención,5,"Geschmacklich ist der J.J.Darboven Café Intención mild-aromatisch, harmonisch-rund und das Fair-Trade Siegel gibt dem Aroma einen tollen Beigeschmack!"
399,J.J. Darboven Café Intención,5,Sehr zu empfehlen!
400,GEPA Kaffee,5,sehr leckerer Espresso mit toller Crema und mild würzigem Geschmack wir haben einen Kaffeevollautomaten un dder Espresso sowei der Cappuccino und auch Latte macchiato schmecken mit diesem Kaffe SUPER! Preis Leistungverhältnis stimmt auch!
401,GEPA Kaffee,5,"Ich trinke aus vier Gründen ausschließlich Kaffee von GEPA: 1. Der Kaffee ist fair gehandelt. 2. Die Auswahl an verschiedenen Sorten und Stärken ist umfangreich. 3. Die Sorten sind tatsächlich geschmacklich gut voneinander zu unterscheiden, was ein Hinweis auf eine gute Qualität ist. 4. Bisher hat mir jede Sorte geschmeckt! Also wer gerne Kaffee trinkt, tut sich und den Kaffeebauern mit einem Kauf was gutes!"
402,GEPA Kaffee,5,"Als ich den Kaffee zum ersten Mal gekauft habe, war ich skeptisch, da ich eigentlich meine „feste“ Kaffeemarke habe. Doch als ich ihn dann getrunken habe, musste ich überraschenderweise feststellen, dass er ein unvergleichliches Aroma hat. Sicher er schmeckt anders wie „mein“ sonst getrunkener Kaffee, aber dennoch wirklich gut. Die Verpackung fand ich auch sehr ansprechend und auch wenn er etwas teuer ist, ist mir der Geschmack und insbesondere der Fair-Trade-Gedanke dahinter, den Preis mehr als wert. Ich vergeben daher fünf von fünf Punkten."
403,GEPA Kaffee,5,"Es ist ein sehr guter Kaffee, perfekt für meinen Geschmack"
404,GEPA Kaffee,5,"Dieser Kaffee macht Lust auf mehr. Schon beim öffnen der Tüte steigen dem Kaffeegenießer die kräftigen Aromen in die Nase. Bei den einzelnen Sorten handelt es sich um Kaffee der Spitzenklasse. Schon nach einer Tasse am Morgen hat man das Gefühl, eine gute Tat vollbracht zu haben. Nicht nur für sich selbst, sondern auch für die vielen Kaffeebauern, die durch meinen Kaffeekonsum fair bezahlt werden und sozial abgesichert sind. Ein wahnsinnig tolles Projekt!"
